{"schemaVersion":1,"baseCommit":"aaaaaaaaaaaaaaaaaaaaaaaaaaaaaaaaaaaaaaaa","headCommit":"bbbbbbbbbbbbbbbbbbbbbbbbbbbbbbbbbbbbbbbb","diff":"diff --git a/a b/a\n","artifacts":[{"path":"openspec/changes/example/proposal.md","sha256":"cccccccccccccccccccccccccccccccccccccccccccccccccccccccccccccccc","bytes":12}],"validationEvidence":["tests"],"manifestDigest":"dddddddddddddddddddddddddddddddddddddddddddddddddddddddddddddddd"}
